{
  "formatVersion": 1,
  "id": "org.example.conformance",
  "version": "1.0.0",
  "title": "Conformance case",
  "license": "CC0-1.0",
  "sourceLanguage": "de",
  "targetLanguage": "it",
  "sections": [
    {
      "id": "s1",
      "title": "Lektion 1"
    }
  ],
  "content": [
    {
      "type": "vocabulary",
      "entries": [
        {
          "id": "casa",
          "term": "la casa",
          "translation": "das Haus",
          "sectionIds": [
            "s1"
          ],
          "audio": "audio/casa.opus"
        },
        {
          "id": "sole",
          "term": "il sole",
          "translation": "die Sonne",
          "sectionIds": [
            "s1"
          ],
          "audio": "audio/sole.m4a"
        },
        {
          "id": "mare",
          "term": "il mare",
          "translation": "das Meer",
          "sectionIds": [
            "s1"
          ],
          "audio": "audio/mare.mp3"
        }
      ]
    }
  ]
}
