{
  "formatVersion": 1,
  "id": "org.example.conformance",
  "version": "1.0.0",
  "title": "Conformance case",
  "license": "CC0-1.0",
  "sourceLanguage": "de",
  "targetLanguage": "it",
  "sections": [
    {
      "id": "s1",
      "title": "Lektion 1"
    }
  ],
  "content": [
    {
      "type": "vocabulary",
      "entries": [
        {
          "id": "kaese",
          "term": "il formaggio",
          "translation": "der Käse",
          "sectionIds": [
            "s1"
          ]
        },
        {
          "id": "kaese-2",
          "term": "il formaggio",
          "translation": "der Käse",
          "sectionIds": [
            "s1"
          ]
        }
      ]
    }
  ]
}
